{"checksums_file":"checksums.sha256","compatible_profiles":[],"created_by":{"compatibility_sha256":"f39aebda1fdafc20d04b6c6a0072a491afea3f8f9ab836fd173ead0d1fe1ea33","compiler_sha256":"44a90884a9ff188718ed839aed4c8d692c8c520216c6a7b072ca6d0d35aa7fbc","cpu_baseline":"x86-64","seen_commit":"a05932e231e33c7512be3432e9d88a938466f820","seen_version":"0.19.4"},"engine_id":"71fcf096f84a2a9940fe0d31497ddf6970bf15db5640c990348472903f1cd870","format":{"sqw_version":"1.0","sqw_whole_sha256":"4444444444444444444444444444444444444444444444444444444444444444","tensor_count":866,"weights_bytes":"54641399999","weights_file":"weights.sqw","weights_sha256":"3333333333333333333333333333333333333333333333333333333333333333"},"intended_backend":{"bound":false,"kind":"cuda","target":"sm_89"},"maturity":"offline-validated","memory":{"max_profile_bytes":"0","persistent_state_bytes":"0","status":"not-runtime-sized","weight_bytes":"54641399999"},"model":{"contract":"seen-qwen38-text-v1","id":"Qwen/Qwen3.8-27B","layers":64,"mtp_tensors":15,"native_context":262144,"revision":"1d4bf0f2ff6012fd82039f2fa52739d0dd7c60c0","text_tensors":851,"vision_tensors":0,"vocab_size":248320},"model_lock_sha256":"1111111111111111111111111111111111111111111111111111111111111111","quantization":{"fallback":"prohibited","lossy":false,"policy_id":"bf16-bringup-v1","policy_sha256":"ae8ab061f558f57ada0a026ca03a85be95d719e014d07126d33f040563638028","quality_approved":false,"runtime_codec":"BF16","source_dtype":"BF16","tensor_count":866},"schema":"seen-qwen-engine-artifact-v1","source_lock_sha256":"2222222222222222222222222222222222222222222222222222222222222222","tokenizer":[{"bytes":"65012","path":"README.md","sha256":"57e4bdb258ee1a7d2635c5174ebd4e56abe392505cdb5f8bbb356b0dc4293641"},{"bytes":"8952","path":"chat_template.jinja","sha256":"c3cf9e34abf4f9e36c2d72165aa9c132d3e2a725b6c2586aaa3a8af9d7a81041"},{"bytes":"4312","path":"config.json","sha256":"191e0af232104ed8b65258cf3fb2b842e288008baca7633c11b82a1ac7203aab"},{"bytes":"202","path":"generation_config.json","sha256":"e70c136c1b78ddc1fb0905bac8e733a4dc448d4f852a5dd75143fffc70be550e"},{"bytes":"3353259","path":"merges.txt","sha256":"a9d356d7bdf1ef4949e3e748e95b8e10ad9d4e2e838eddc38a0a7b6b94d1db8d"},{"bytes":"17928","path":"tokenizer_config.json","sha256":"b11349aafa7cdc6a320767cf7ceb29ed82f7eda5d65e8e0819e76f0ce947bf27"},{"bytes":"6722759","path":"vocab.json","sha256":"ce99b4cb2983d118806ce0a8b777a35b093e2000a503ebde25853284c9dfa003"}],"version":1}
